[
  {
    "job_id": "job_mlkem768_liboqs_liboqs_mlkem768_wrapper_generic_vs_pqclean_pqclean_mlkem768_clean",
    "pair_id": "mlkem768_liboqs_liboqs_mlkem768_wrapper_generic_vs_pqclean_pqclean_mlkem768_clean",
    "family": "ML-KEM",
    "parameter_set": "768",
    "primitive_type": "kem",
    "oracle_mode": "kem_cross_impl_shared_semantics",
    "abi": {
      "left": {
        "pk_len": 1184,
        "sk_len": 2400,
        "ct_len": 1088,
        "ss_len": 32,
        "sig_max_len": null
      },
      "right": {
        "pk_len": 1184,
        "sk_len": 2400,
        "ct_len": 1088,
        "ss_len": 32,
        "sig_max_len": null
      }
    },
    "capability_flags": {
      "left": {
        "supports_keygen_derand": true,
        "supports_encaps_derand": true,
        "supports_sign_derand": false
      },
      "right": {
        "supports_keygen_derand": false,
        "supports_encaps_derand": false,
        "supports_sign_derand": false
      }
    },
    "determinism_policy": {
      "prefer_seeded_keygen": true,
      "prefer_seeded_encaps": true,
      "prefer_seeded_sign": false,
      "compare_raw_signature_bytes": false
    },
    "interop_policy": {
      "public_key_exchange": "declared-compatible",
      "ciphertext_exchange": "declared-compatible"
    },
    "enabled_subtests": [
      "left_seeded_keygen_local_roundtrip",
      "cross_decaps_if_declared_compatible"
    ],
    "mismatch_labels": [
      "return_code_mismatch",
      "shared_secret_mismatch"
    ],
    "paths": {
      "generated_harness": "workspace/tmp/job_mlkem768_liboqs_liboqs_mlkem768_wrapper_generic_vs_pqclean_pqclean_mlkem768_clean/generated_harness.cpp",
      "result_dir": "workspace/results/job_mlkem768_liboqs_liboqs_mlkem768_wrapper_generic_vs_pqclean_pqclean_mlkem768_clean",
      "crash_dir": "workspace/crashes/job_mlkem768_liboqs_liboqs_mlkem768_wrapper_generic_vs_pqclean_pqclean_mlkem768_clean",
      "run_dir": "workspace/runs/job_mlkem768_liboqs_liboqs_mlkem768_wrapper_generic_vs_pqclean_pqclean_mlkem768_clean"
    },
    "replay_policy": {
      "write_findings": true,
      "finding_format": "jsonl",
      "summary_filename": "summary.json"
    },
    "sanity_checks": {
      "required_operations": [
        "keygen",
        "encaps",
        "decaps"
      ],
      "cross_exchange_allowed": true,
      "raw_signature_byte_comparison_allowed": false
    }
  },
  {
    "job_id": "job_mldsa65_liboqs_liboqs_mldsa65_wrapper_generic_vs_pqclean_pqclean_mldsa65_clean",
    "pair_id": "mldsa65_liboqs_liboqs_mldsa65_wrapper_generic_vs_pqclean_pqclean_mldsa65_clean",
    "family": "ML-DSA",
    "parameter_set": "65",
    "primitive_type": "sig",
    "oracle_mode": "sig_cross_impl_verify_semantics",
    "abi": {
      "left": {
        "pk_len": 1952,
        "sk_len": 4032,
        "ct_len": null,
        "ss_len": null,
        "sig_max_len": 3309
      },
      "right": {
        "pk_len": 1952,
        "sk_len": 4032,
        "ct_len": null,
        "ss_len": null,
        "sig_max_len": 3309
      }
    },
    "capability_flags": {
      "left": {
        "supports_keygen_derand": false,
        "supports_encaps_derand": false,
        "supports_sign_derand": true
      },
      "right": {
        "supports_keygen_derand": false,
        "supports_encaps_derand": false,
        "supports_sign_derand": false
      }
    },
    "determinism_policy": {
      "prefer_seeded_keygen": true,
      "prefer_seeded_encaps": true,
      "prefer_seeded_sign": false,
      "compare_raw_signature_bytes": false
    },
    "interop_policy": {
      "public_key_exchange": "declared-compatible",
      "signature_exchange": "declared-compatible"
    },
    "enabled_subtests": [
      "left_sign_left_verify",
      "left_sign_right_verify_if_allowed"
    ],
    "mismatch_labels": [
      "verify_result_mismatch",
      "cross_verify_failure"
    ],
    "paths": {
      "generated_harness": "workspace/tmp/job_mldsa65_liboqs_liboqs_mldsa65_wrapper_generic_vs_pqclean_pqclean_mldsa65_clean/generated_harness.cpp",
      "result_dir": "workspace/results/job_mldsa65_liboqs_liboqs_mldsa65_wrapper_generic_vs_pqclean_pqclean_mldsa65_clean",
      "crash_dir": "workspace/crashes/job_mldsa65_liboqs_liboqs_mldsa65_wrapper_generic_vs_pqclean_pqclean_mldsa65_clean",
      "run_dir": "workspace/runs/job_mldsa65_liboqs_liboqs_mldsa65_wrapper_generic_vs_pqclean_pqclean_mldsa65_clean"
    },
    "replay_policy": {
      "write_findings": true,
      "finding_format": "jsonl",
      "summary_filename": "summary.json"
    },
    "sanity_checks": {
      "required_operations": [
        "keygen",
        "sign",
        "verify"
      ],
      "cross_exchange_allowed": true,
      "raw_signature_byte_comparison_allowed": false
    }
  }
]
